{
  "model_id": "example-decoder-local-artifact-do-not-admit",
  "model_family": "example_decoder_family",
  "architecture": "decoder_only",
  "parameter_count": 500000000,
  "quantization": "q4-example",
  "context_length": 4096,
  "tokenizer_type": "example-tokenizer",
  "source_url": "example-only-no-runtime-url",
  "source_commit_or_revision": "example-revision-do-not-admit",
  "license": "EXAMPLE_ONLY",
  "license_url": "example-only-no-runtime-url",
  "converted_by": "example-reviewer",
  "conversion_tool": "example-converter",
  "conversion_command": "example only; do not run",
  "conversion_date": "2026-06-29",
  "contains_private_data": false,
  "review_status": "example",
  "reviewer": "",
  "target_profile": "pro_static_llm_full",
  "expected_total_bytes": 350000000,
  "expected_shard_count": 12,
  "notes": "Example metadata only. Real metadata must replace all example values before production admission."
}
