{
  "model_id": "placeholder_model_id_do_not_admit",
  "model_family": "placeholder_model_family",
  "architecture": "decoder_only",
  "parameter_count": 0,
  "quantization": "placeholder_quantization",
  "context_length": 0,
  "tokenizer_type": "placeholder_tokenizer_type",
  "source_url": "https://example.invalid/source",
  "source_commit_or_revision": "placeholder_revision",
  "license": "placeholder_license",
  "license_url": "https://example.invalid/license",
  "converted_by": "placeholder_reviewer_or_tool_owner",
  "conversion_tool": "placeholder_conversion_tool",
  "conversion_command": "placeholder_conversion_command",
  "conversion_date": "YYYY-MM-DD",
  "contains_private_data": false,
  "review_status": "candidate",
  "reviewer": "placeholder_reviewer",
  "target_profile": "pro_static_llm_full",
  "expected_total_bytes": 0,
  "expected_shard_count": 0,
  "notes": "Template only. Replace placeholders before review."
}
